{
  "schema_version": "1.0",
  "project_id": "discarded-designs",
  "canon_version": "v1-draft",
  "status": "draft",
  "emotional_promise": "被忽略的方案变成真实改善，主角获得成长与专业认可",
  "story_engine": "把被放弃的设计取成实物→立刻解决一个问题→留下资源与认可→用同一能力改变更大的空间或协作难题",
  "characters": [
    {
      "id": "CHAR-001",
      "name": "沈砚，旧图纸修复员",
      "details": "以示例首集与制作连续性锁为准"
    },
    {
      "id": "CHAR-002",
      "name": "周工，泵站工程师",
      "details": "以示例首集与制作连续性锁为准"
    },
    {
      "id": "CHAR-003",
      "name": "许姨，社区供水联络员",
      "details": "以示例首集与制作连续性锁为准"
    }
  ],
  "locations": [
    {
      "id": "LOC-001",
      "name": "老泵房，含门口取水台",
      "details": "以示例首集与制作连续性锁为准"
    }
  ],
  "props": [
    {
      "id": "PROP-001",
      "name": "被弃用的旁路芯设计图",
      "details": "以示例首集与制作连续性锁为准"
    },
    {
      "id": "PROP-002",
      "name": "实体旁路芯，两只同型铜环",
      "details": "以示例首集与制作连续性锁为准"
    },
    {
      "id": "PROP-003",
      "name": "泵站主机",
      "details": "以示例首集与制作连续性锁为准"
    },
    {
      "id": "PROP-004",
      "name": "透明水杯",
      "details": "以示例首集与制作连续性锁为准"
    },
    {
      "id": "PROP-005",
      "name": "工程档案钥匙",
      "details": "以示例首集与制作连续性锁为准"
    },
    {
      "id": "PROP-006",
      "name": "旧跨谷输水桥总图",
      "details": "以示例首集与制作连续性锁为准"
    }
  ],
  "rules": [
    {
      "id": "RULE-001",
      "text": "沈砚能把设计图里的非生命物件按设计尺寸取成实物，部件和整机都有效。它按图成形；选择适合当前目标的设计仍由人决定。",
      "evidence_plan": "首集从废图取出铜环并使缺件主机恢复供水；以后按具体用途展示规模和组合，不临时追加资格门槛"
    },
    {
      "id": "RULE-002",
      "text": "图纸取物后保持完整，可以重复使用；生成的物件真实留存，不因切换图纸或进入下一集消失。",
      "evidence_plan": "首集同图再取出一只备用铜环，一只装入主机，一只留在纸旁"
    }
  ],
  "initial_fact_ids": [],
  "locked_canon": [
    "没有扣血或折寿代价",
    "主角不会突然失去已建立能力",
    "冲突来自选什么设计、放在哪里、怎样连接和谁愿意合作，不靠每次失灵或把奖品收走",
    "周工胜利后保持专业认可，不重复不知情式嘲讽"
  ],
  "ending_direction": "由个人修复走向让各社区参与定义并实现需要的公共工程",
  "world_feedback": []
}
